{
  "attempts": [
    {
      "attempt": 1,
      "runtime_s": 0.2441,
      "status": "succeeded"
    }
  ],
  "candidate_id": "cand_mock-demo-i0-s3",
  "cost": {
    "basis": "mock engine: no compute or API cost",
    "usd_estimated": 0.0
  },
  "engine": {
    "engine_id": "mock",
    "model_id": "mock-procedural-v1"
  },
  "engine_metadata": {
    "mode": "ok",
    "not_a_generative_model": true,
    "renderer": "procedural-numpy"
  },
  "errors": [],
  "finished_at": "2026-10-10T08:44:32.399776Z",
  "images": [
    {
      "format": "PNG",
      "height": 640,
      "path": "images/cand_mock-demo-i0-s3/a1/image_0.png",
      "sha256": "f676d5358529dfe4daad19e2662eda8c3e9ffacba1e7e9957083aa7639a9cd95",
      "width": 512
    }
  ],
  "request_id": "req_mock-demo-i0-s3",
  "result_id": "result_mock-demo-i0-s3",
  "runtime_s": 0.2458,
  "schema_version": "atelier.generation_result.v1",
  "seed_used": 20284767,
  "started_at": "2026-10-10T08:44:32.153976Z",
  "status": "succeeded"
}
